Front,Back,Extra,Tags
"A software development team needs to track work items with custom fields for sprint planning, priority levels, and dependencies between tasks. The solution must integrate with code commits and pull requests.<br><br>A) GitHub Issues with labels and milestones<br>B) GitHub Projects with custom fields and issue linking<br>C) Third-party project management tool","B) GitHub Projects with custom fields and issue linking","GitHub Projects (Projects v2) supports custom fields for any metadata, links to issues/PRs automatically, and provides views (board, table, roadmap). Issues with labels lack custom fields flexibility. Third-party tools lose native GitHub integration. Projects v2 is GitHub's native project management with full customization.","GH-300 ProjectManagement CustomFields"
"Your company requires that all commit messages follow Conventional Commits format (type: description) with automatic enforcement blocking non-compliant commits.<br><br>A) GitHub Actions with commitlint validation on pull requests<br>B) Git hooks on developer workstations<br>C) Manual code review of commit messages","A) GitHub Actions with commitlint validation on pull requests","GitHub Actions with commitlint runs on PR events, validates commit message format, and blocks merge via status checks. Git hooks are client-side only (bypassable). Manual review doesn't scale and is error-prone. Server-side validation provides enforceable commit message standards.","GH-300 Governance CommitStandards"
"A GitHub repository contains a monorepo with 20 services. Pull requests should automatically be assigned to code owners based on the files changed, preventing merge without owner approval.<br><br>A) CODEOWNERS file with path patterns and branch protection requiring owner review<br>B) Manual PR assignment<br>C) GitHub Actions workflow for assignment","A) CODEOWNERS file with path patterns and branch protection requiring owner review","CODEOWNERS file maps paths to teams/users, automatically requests reviews when files change, branch protection enforces owner approval. Manual assignment doesn't scale. Actions can assign but don't natively integrate with branch protection. CODEOWNERS is the native ownership and review routing mechanism.","GH-300 Governance CodeOwnership"
"A development workflow requires that feature branches be automatically deleted after pull request merge to prevent repository clutter, but release branches must be preserved.<br><br>A) Repository settings for automatic branch deletion with protected branch exclusions<br>B) Manual branch cleanup<br>C) GitHub Actions workflow deleting all branches","A) Repository settings for automatic branch deletion with protected branch exclusions","Repository auto-delete merged branches setting preserves protected branches automatically. Manual cleanup doesn't scale and is forgotten. Workflow-based deletion lacks built-in protected branch awareness. Native auto-delete respects protection rules and reduces clutter.","GH-300 RepositoryManagement BranchManagement"
"Your organization needs to measure code review effectiveness: time to first review, number of review rounds, and reviewer participation across 200 repositories.<br><br>A) GitHub GraphQL API querying pull request review timeline and aggregating metrics<br>B) Manual tracking in spreadsheets<br>C) GitHub Insights dashboard only","A) GitHub GraphQL API querying pull request review timeline and aggregating metrics","GraphQL API provides detailed PR timeline data (reviewRequestedAt, reviewedAt, review counts) for custom analytics. Manual tracking doesn't scale. Insights provides some metrics but GraphQL enables custom KPIs. API access allows building tailored code review analytics dashboards.","GH-300 Analytics CodeReview"
"A GitHub Actions workflow must build and test code triggered by pull_request events, but certain paths (/docs, README.md) should not trigger expensive CI builds.<br><br>A) GitHub Actions paths-ignore filter on pull_request trigger<br>B) Run all builds and waste resources<br>C) Require manual workflow dispatch","A) GitHub Actions paths-ignore filter on pull_request trigger","paths-ignore prevents workflow execution when only specified paths change, optimizing CI costs. Running all builds wastes resources. Manual dispatch removes automation benefits. Path filtering is the built-in CI optimization for monorepos and documentation changes.","GH-300 CICD Optimization"
"Your security policy requires that GitHub personal access tokens expire after 90 days maximum, with automatic enforcement preventing creation of longer-lived tokens.<br><br>A) Organization security policy setting maximum token lifetime<br>B) Email reminders to users<br>C) Manual token audits","A) Organization security policy setting maximum token lifetime","Organization policies enforce maximum token expiration, preventing users from creating longer-lived tokens. Email reminders rely on user compliance. Manual audits are point-in-time. Policy enforcement proactively limits credential lifetime risk at the identity provider level.","GH-300 Security TokenManagement"
"A GitHub Enterprise environment must support custom branding with company logo, color scheme, and custom domain for GitHub Pages sites.<br><br>A) GitHub Enterprise with custom branding settings and GitHub Pages custom domain<br>B) GitHub.com with organization profile<br>C) Self-hosted Git server with custom UI","A) GitHub Enterprise with custom branding settings and GitHub Pages custom domain","GitHub Enterprise supports custom logos, colors, navigation customization, and Pages custom domains. GitHub.com org profiles have limited customization. Self-hosted servers require maintaining custom UI. Enterprise provides managed custom branding capabilities.","GH-300 Administration Branding"
"A CI/CD pipeline must deploy to production only during a specified maintenance window (Saturday 00:00-04:00 UTC) with automated approval workflow outside the window.<br><br>A) GitHub Actions with schedule triggers and conditional deployment logic based on time<br>B) Manual deployment timing<br>C) Disable workflows outside maintenance window","A) GitHub Actions with schedule triggers and conditional deployment logic based on time","Actions can evaluate current time, conditionally run deployment steps during window, or wait/require approval outside window. Manual deployment risks errors. Disabling workflows loses flexibility. Time-based conditionals enable maintenance window enforcement in automation.","GH-300 CICD DeploymentControl"
"Your organization needs GitHub Copilot deployed to 500 developers with usage analytics showing code acceptance rates and language distribution.<br><br>A) GitHub Copilot for Business with organization-level analytics dashboard<br>B) GitHub Copilot Individual for each developer<br>C) No usage tracking","A) GitHub Copilot for Business with organization-level analytics dashboard","Copilot for Business provides centralized billing, policy management, and usage analytics showing suggestions, acceptances, and languages. Individual licenses lack org-level analytics. No tracking prevents ROI measurement. Business tier is the enterprise AI coding assistant deployment model.","GH-300 AITools UsageAnalytics"
"A development team practices trunk-based development with feature flags. Releases must be tagged automatically when version numbers in package.json change on the main branch.<br><br>A) GitHub Actions detecting version changes and creating releases with git tags<br>B) Manual release tagging<br>C) Automated nightly builds without version tracking","A) GitHub Actions detecting version changes and creating releases with git tags","Actions workflow compares package.json version on push to main, creates GitHub release and git tag when version increments. Manual tagging is error-prone. Nightly builds don't correlate to versions. Version-driven automated releases align with semantic versioning and trunk-based development.","GH-300 CICD ReleaseAutomation"
"Your company requires that all GitHub OAuth apps used by developers be pre-approved, with automatic blocking of unapproved third-party app access to organization resources.<br><br>A) GitHub organization OAuth app policy restricting to approved apps<br>B) Email policy document<br>C) No app access controls","A) GitHub organization OAuth app policy restricting to approved apps","OAuth app policy allows org admins to approve/deny apps, preventing unapproved app access to org data. Email policies rely on user compliance. No controls create data exfiltration risk. OAuth app restrictions enforce third-party access governance at the platform level.","GH-300 Security AppManagement"
"A GitHub repository needs to enforce Gitflow workflow with protected master and develop branches, requiring pull requests for all changes and preventing force pushes.<br><br>A) Branch protection rules on master and develop with require PR and block force push<br>B) Developer training only<br>C) Git hooks on client machines","A) Branch protection rules on master and develop with require PR and block force push","Branch protection enforces PR requirement, blocks force-push, and can require status checks per branch. Training doesn't enforce compliance. Client hooks are bypassable. Server-side branch protection provides enforceable workflow constraints.","GH-300 Governance WorkflowEnforcement"
"Your CI/CD pipeline builds Docker images with layer caching to optimize build times. Workflow must use previous build layer cache from the container registry.<br><br>A) GitHub Actions with Docker buildx cache-from and cache-to registry<br>B) No caching, build from scratch<br>C) Manual local cache management","A) GitHub Actions with Docker buildx cache-from and cache-to registry","Docker buildx supports external cache backends (registry, GitHub cache), reusing layers across workflow runs and reducing build time. No caching wastes time. Manual caching doesn't work in ephemeral runners. Registry-backed layer caching optimizes CI container builds.","GH-300 CICD ContainerOptimization"
"A software project needs contributor license agreements (CLA) signed before accepting pull requests, with automated validation blocking merge until CLA is executed.<br><br>A) CLA bot GitHub App with branch protection requiring CLA check<br>B) Manual CLA tracking in spreadsheet<br>C) No CLA enforcement","A) CLA bot GitHub App with branch protection requiring CLA check","CLA Assistant or similar apps automate signature collection, validate contributor status, report via PR check linked to branch protection. Manual tracking doesn't scale. No enforcement creates legal risk. Automated CLA validation provides IP compliance at code contribution time.","GH-300 Compliance CLAManagement"
"Your organization requires all production deployments be immutable with rollback capability, preserving previous application versions and infrastructure state.<br><br>A) GitHub Actions with container immutable tags and IaC state versioning<br>B) Overwrite deployments in place<br>C) Manual backup before deployment","A) GitHub Actions with container immutable tags and IaC state versioning","Immutable deployments use unique image tags (e.g., git SHA), IaC state is versioned in remote backend enabling rollback. In-place updates prevent rollback. Manual backups are error-prone. Immutable deployments + versioned state enable reliable rollback and audit trail.","GH-300 CICD DeploymentStrategy"
"A GitHub repository contains sensitive documentation that should only be accessible to internal employees but the code itself can be public.<br><br>A) Public repository with private wiki for documentation<br>B) Private repository for everything<br>C) Public repository with documentation in separate private repository","C) Public repository with documentation in separate private repository","GitHub wikis inherit repository visibility (public wiki for public repo). Private repo limits code sharing unnecessarily. Separate private repo for sensitive docs + public repo for code provides granular access control. Repository splitting enables mixed visibility scenarios.","GH-300 Security AccessControl"
"Your development workflow requires preview deployments for every pull request with automatic cleanup when PR is closed, minimizing cloud costs.<br><br>A) GitHub Actions creating preview environment per PR, cleanup on close event<br>B) Shared staging environment overwritten per PR<br>C) Manual preview environment provisioning","A) GitHub Actions creating preview environment per PR, cleanup on close event","PR opened event triggers preview deployment, closed event triggers cleanup (IaC destroy). Shared staging causes conflicts. Manual provisioning doesn't scale. Ephemeral per-PR environments enable isolated testing with automatic resource cleanup.","GH-300 CICD PreviewEnvironments"
"A GitHub organization has 100 repositories with inconsistent CI/CD practices. Management wants to standardize linting, testing, and security scanning across all repos.<br><br>A) Organization-level required workflows applied to all repositories<br>B) Copy-paste workflow files to each repository<br>C) Developer documentation only","A) Organization-level required workflows applied to all repositories","Required workflows (org-level) automatically run on all repos, enforce standardization centrally, update once and apply everywhere. Copy-paste creates maintenance burden. Documentation doesn't enforce compliance. Required workflows provide scalable CI/CD governance.","GH-300 Governance StandardizationRequired workflows run automatically on all repositories in an organization, providing centralized enforcement of security scans, linting, and testing standards. Copy-paste creates drift. Documentation alone doesn't ensure compliance. Required workflows scale governance across large repository portfolios.","GH-300 Governance CICDStandardization"
"Your company needs GitHub audit logs exported to AWS S3 for long-term retention with encryption at rest and lifecycle policies archiving to Glacier after 90 days.<br><br>A) GitHub audit log streaming to S3 with SSE and lifecycle rules<br>B) Manual periodic audit log downloads<br>C) GitHub-hosted log retention only","A) GitHub audit log streaming to S3 with SSE and lifecycle rules","Audit log streaming pushes events to S3, SSE-S3/SSE-KMS provides encryption, S3 lifecycle transitions to Glacier for cost optimization. Manual downloads don't scale. GitHub retention is limited. Streaming + S3 lifecycle enables compliant long-term audit log archival.","GH-300 Compliance LogManagement"
"A GitHub Actions workflow requires credentials to deploy to Kubernetes cluster without storing kubeconfig files in repository or as GitHub secrets.<br><br>A) GitHub OIDC provider with Kubernetes service account token projection<br>B) Kubeconfig file in GitHub secrets<br>C) Embed kubeconfig in workflow YAML","A) GitHub OIDC provider with Kubernetes service account token projection","GitHub OIDC provides JWT tokens, Kubernetes can validate and issue short-lived tokens eliminating static credentials. Storing kubeconfig is less secure (rotation challenges). Embedding in YAML exposes credentials in version control. OIDC federation eliminates static Kubernetes credentials.","GH-300 Security KubernetesAuthentication"
"Your development team needs to create draft releases automatically when code is pushed to release/* branches, with release notes generated from commit messages.<br><br>A) GitHub Actions creating draft releases with auto-generated release notes<br>B) Manual release note writing<br>C) No release documentation","A) GitHub Actions creating draft releases with auto-generated release notes","Actions workflow on branch push creates draft release via GitHub API, auto-generated release notes pull commit messages and PR titles. Manual notes are time-consuming. No documentation hinders adoption. Automated draft releases streamline version management and changelog generation.","GH-300 CICD ReleaseManagement"
"A GitHub repository has 10,000 open issues. Management needs to automatically close stale issues with no activity for 90 days after a 14-day warning period.<br><br>A) Stale bot GitHub Action with configured timeframes<br>B) Manual issue triage<br>C) Close all issues at once","A) Stale bot GitHub Action with configured timeframes","Stale Action labels inactive issues, comments with warning, closes after grace period if no response. Manual triage doesn't scale (10K issues). Bulk close loses signal. Automated stale issue management maintains repository health with user notification.","GH-300 Automation IssueManagement"
"Your organization requires fine-grained audit logs showing who accessed which repository, when, and from what IP address for security investigations.<br><br>A) GitHub Enterprise audit log with repository access events and IP logging<br>B) Server access logs only<br>C) No access tracking","A) GitHub Enterprise audit log with repository access events and IP logging","Enterprise audit log captures repository access events with actor, timestamp, IP address, and action details queryable via API or streaming. Server logs miss application-level actions. No tracking prevents incident investigation. Audit log is the authoritative source for access forensics.","GH-300 Security AccessAuditing"
"A CI/CD workflow must execute different build steps based on git branch: feature/* runs tests only, develop runs tests and deploys to staging, main deploys to production.<br><br>A) GitHub Actions with conditional job execution using github.ref or branch filters<br>B) Separate workflows per branch<br>C) Single workflow with no differentiation","A) GitHub Actions with conditional job execution using github.ref or branch filters","if: github.ref == 'refs/heads/main' conditionally runs jobs, or on.push.branches filters trigger workflows per branch pattern. Separate workflows duplicate logic. Single undifferentiated workflow lacks environment isolation. Conditional execution provides branch-aware CI/CD logic.","GH-300 CICD BranchStrategy"
"Your security team needs GitHub Advanced Security alerts aggregated across 500 repositories with daily email reports summarizing new vulnerabilities by severity.<br><br>A) GitHub GraphQL API querying organization security alerts with scheduled report generation<br>B) Manually check each repository security tab<br>C) Email notifications per repository only","A) GitHub GraphQL API querying organization security alerts with scheduled report generation","GraphQL API aggregates Dependabot, CodeQL, and secret scanning alerts across orgs, enables custom reporting (daily summaries, severity breakdown). Manual checking doesn't scale (500 repos). Per-repo emails create noise. Centralized API-driven reporting provides actionable security visibility.","GH-300 Security ReportingDescribe the problem you are trying to solve","GH-300 Security VulnerabilityReporting"
"A GitHub repository tracks bugs, features, and documentation tasks. Work items should be automatically categorized and prioritized based on labels with visualization in project boards.<br><br>A) GitHub Projects automation with label-based field updates and views<br>B) Manual project board updates<br>C) No project management","A) GitHub Projects automation with label-based field updates and views","Projects v2 workflows automatically set custom fields (priority, type) based on issue labels, filtered views show categorized work. Manual updates don't scale. No PM loses visibility. Label-driven project automation provides organized work tracking with minimal manual effort.","GH-300 ProjectManagement Automation"
"Your company requires that all pushes to production branches trigger security scans, and detected vulnerabilities automatically create Jira tickets assigned to security team.<br><br>A) GitHub Actions with security scanning and Jira API integration on push events<br>B) Manual security reviews<br>C) Scheduled weekly scans only","A) GitHub Actions with security scanning and Jira API integration on push events","Push-triggered Actions run security tools (Trivy, Snyk), parse results, create Jira issues via API with vulnerability details. Manual reviews lag behind commits. Weekly scans delay detection. Real-time push-based scanning + ticketing provides immediate security feedback loop.","GH-300 Security Integration"
"A GitHub Actions workflow must authenticate to Azure using federated credentials without storing any client secrets, with permissions scoped to specific resource groups.<br><br>A) GitHub OIDC provider with Azure AD federated identity and RBAC assignments<br>B) Service principal credentials in GitHub secrets<br>C) Shared admin account","A) GitHub OIDC provider with Azure AD federated identity and RBAC assignments","GitHub OIDC issues tokens, Azure AD trusts GitHub as identity provider, service principal uses federated credential (no secret), RBAC limits permissions. Stored secrets have rotation challenges. Shared accounts lack audit trail. Federated identity + RBAC provides secretless, scoped Azure access.","GH-300 Security AzureIntegration"
"Your development team needs pull request templates enforcing checklist items: tests updated, documentation updated, breaking changes documented.<br><br>A) .github/pull_request_template.md with markdown checklist<br>B) Wiki documentation with PR guidelines<br>C) Email with PR requirements","A) .github/pull_request_template.md with markdown checklist","PR template file automatically populates PR description with checklist, ensuring consistent information and review criteria. Wiki requires manual lookup. Email guidelines are ignored. Templates provide structured, enforceable PR information collection.","GH-300 Governance PRStandards"
"A GitHub Enterprise Server instance needs to support air-gapped deployment in a secure facility with no internet access, including package installation and GitHub Actions runner functionality.<br><br>A) GitHub Enterprise Server offline installation with pre-downloaded actions and self-hosted runners<br>B) GitHub Enterprise Cloud<br>C) Require internet access","A) GitHub Enterprise Server offline installation with pre-downloaded actions and self-hosted runners","GHES supports offline installation via package download, self-hosted runners don't need internet, Actions can use local actions repositories. Cloud requires internet. Internet access violates air-gap requirement. GHES offline + local actions enables secure air-gapped SCM.","GH-300 Administration AirGapped"
"Your organization needs to prevent repository forks from being created to avoid code leakage, while still allowing internal collaboration on repositories.<br><br>A) Organization settings disabling fork creation for private repositories<br>B) Repository permission restrictions<br>C) User training only","A) Organization settings disabling fork creation for private repositories","Org policy controls fork creation by repository visibility (allow public, block private). Permission restrictions don't prevent forking. Training doesn't enforce. Fork policy prevents private code distribution via forks while enabling public OSS contribution workflows.","GH-300 Security ForkManagement"
"A CI/CD pipeline must execute integration tests requiring three microservices running simultaneously with service discovery and networking.<br><br>A) GitHub Actions service containers with network aliases<br>B) External test environment setup<br>C) Mock all dependencies","A) GitHub Actions service containers with network aliases","Service containers run in same Docker network, accessible via service name as hostname, enabling realistic integration testing. External environments add complexity. Mocks don't catch integration issues. Service containers provide isolated, realistic multi-service testing in CI.","GH-300 CICD IntegrationTesting"
"Your company requires notification when any repository in the organization is made public, with automatic reversion to private within 5 minutes.<br><br>A) GitHub webhook for repository visibility changes with automated remediation workflow<br>B) Daily manual audit<br>C) Rely on user awareness","A) GitHub webhook for repository visibility changes with automated remediation workflow","Repository webhook emits event on visibility change, automation (Action or external) reverts to private via API within minutes. Daily audit has large detection window. User awareness doesn't prevent accidents. Real-time webhook-based monitoring + automated response prevents data exposure.","GH-300 Security VisibilityControl"
"A GitHub Actions workflow must publish npm packages to GitHub Packages registry with version validation preventing accidental republishing of existing versions.<br><br>A) GitHub Actions with npm publish, GITHUB_TOKEN authentication, and version check script<br>B) Publish without version validation<br>C) Manual npm publish","A) GitHub Actions with npm publish, GITHUB_TOKEN authentication, and version check script","Actions publish workflow uses GITHUB_TOKEN (auto-provided, scoped), script checks existing versions in registry before publish preventing overwrites. No validation causes failures. Manual publish lacks automation benefits. Version-aware automated publishing prevents registry conflicts.","GH-300 CICD PackageManagement"
