Front,Back,Extra,Tags
"Your CI/CD pipeline must generate software bill of materials (SBOM) for compliance, tracking all dependencies and their versions in production deployments.<br><br>A) GitHub Actions with SBOM generation tool (syft, cyclonedx) publishing artifacts<br>B) Manual dependency documentation<br>C) No SBOM generation","A) GitHub Actions with SBOM generation tool (syft, cyclonedx) publishing artifacts","Actions workflow generates SBOM (CycloneDX/SPDX format) from build artifacts, uploads as release asset or artifact for compliance/security analysis. Manual docs become stale. No SBOM prevents vulnerability correlation. Automated SBOM generation provides supply chain transparency.","GH-300 Compliance SBOM"
"A GitHub organization has multiple development teams with separate security requirements. Security policies should be enforced per team with team-specific vulnerability thresholds.<br><br>A) Repository rulesets scoped to team-owned repository patterns<br>B) Single organization-wide security policy<br>C) No security enforcement","A) Repository rulesets scoped to team-owned repository patterns","Rulesets target repositories by naming pattern or team ownership, enabling team-specific policies (security scanning, branch protection). Single policy too broad or too restrictive. No enforcement creates inconsistency. Scoped rulesets provide flexible, team-aligned security governance.","GH-300 Governance TeamPolicies"
"Your company requires that GitHub CLI (gh) be authenticated using device flow for headless CI environments without browser access.<br><br>A) GitHub CLI device flow authentication with gh auth login --with-token<br>B) Personal access token environment variable<br>C) OAuth web flow","A) GitHub CLI device flow authentication with gh auth login --with-token","Device flow displays code for user activation on another device, suitable for headless environments. PAT in env works but less secure than OAuth. Web flow requires browser (unavailable headless). Device flow provides user-friendly headless authentication.","GH-300 Authentication CLIAuthentication"
"A GitHub repository must enforce conventional commits (type(scope): message) with automatic changelog generation on release from commit messages.<br><br>A) Commitlint validation in PR checks + semantic-release for automated changelogs<br>B) Manual changelog maintenance<br>C) No commit standards","A) Commitlint validation in PR checks + semantic-release for automated changelogs","Commitlint CI check enforces conventional commits, semantic-release parses commit types (feat, fix) to auto-generate changelogs and determine version bumps. Manual changelogs lag and are error-prone. No standards prevent automation. Conventional commits + semantic-release automate version management.","GH-300 Automation ReleaseAutomation"
"Your development workflow requires database schema migrations be validated in CI before deployment with automatic rollback scripts generated.<br><br>A) GitHub Actions with database migration tool (Flyway, Liquibase) dry-run validation<br>B) No migration validation<br>C) Test migrations in production","A) GitHub Actions with database migration tool (Flyway, Liquibase) dry-run validation","Migration tools validate syntax, simulate applying to test database in CI, generate rollback scripts automatically. No validation creates deployment failures. Testing in production is dangerous. CI migration validation catches schema issues before production deployment.","GH-300 CICD DatabaseMigrations"
"A GitHub Enterprise organization needs to measure adoption metrics: active users, repository activity, CI/CD usage, and security feature enablement across business units.<br><br>A) GitHub Enterprise Server/Cloud Admin API and audit logs with custom analytics<br>B) Manual usage surveys<br>C) No metrics tracking","A) GitHub Enterprise Server/Cloud Admin API and audit logs with custom analytics","Admin API provides user counts, repository stats, Actions usage, security feature enablement; audit logs track activities. Custom dashboards aggregate per BU. Manual surveys don't capture actual usage. No metrics prevent ROI measurement. API-driven analytics provide data-driven GitHub adoption visibility.","GH-300 Analytics AdoptionMetrics"
"Your organization requires GPG keys for commit signing be managed centrally with automatic key distribution to developers and revocation on employee departure.<br><br>A) Organization PKI with automated GPG key provisioning and lifecycle management<br>B) Individual developer key management<br>C) No commit signing","A) Organization PKI with automated GPG key provisioning and lifecycle management","Enterprise PKI issues GPG keys to developers automatically, revokes on termination, integrates with identity provider. Individual management doesn't scale and keys aren't revoked. No signing allows commit impersonation. Centralized GPG key lifecycle enables scalable commit authenticity verification.","GH-300 Security KeyManagement"
"A GitHub Actions workflow must cache build artifacts with automatic cache eviction after 7 days to manage storage costs while maximizing cache hit rates.<br><br>A) GitHub Actions cache with custom key strategy and TTL awareness<br>B) No caching, build from scratch<br>C) Permanent cache storage","A) GitHub Actions cache with custom key strategy and TTL awareness","GitHub cache automatically evicts after 7 days, cache key strategy (hash of dependencies) ensures proper invalidation. No cache wastes time. Permanent cache consumes storage indefinitely. TTL-aware caching with smart key strategy balances performance and storage cost.","GH-300 CICD CacheManagement"
"Your security policy requires that all production deployments be signed and verifiable, proving provenance from specific GitHub workflows.<br><br>A) GitHub Actions attestation generation with Sigstore signatures<br>B) Unsigned deployments<br>C) Manual deployment documentation","A) GitHub Actions attestation generation with Sigstore signatures","GitHub generates signed build provenance attestations using Sigstore, verifiable later to prove build origin and integrity. Unsigned deployments can't prove authenticity. Manual docs aren't tamper-proof. Cryptographic attestations provide supply chain security with verifiable build provenance.","GH-300 Security ProvenanceAttestations"
"A GitHub repository has 50 contributors from different time zones. Code review response time must be minimized by assigning reviewers in currently working timezones.<br><br>A) GitHub Actions with timezone-aware reviewer assignment logic<br>B) Random reviewer assignment<br>C) Manual timezone coordination","A) GitHub Actions with timezone-aware reviewer assignment logic","Action determines PR author timezone, selects reviewers in working hours (or next timezone), assigns via API minimizing review latency. Random assignment ignores availability. Manual coordination doesn't scale. Timezone-aware automation optimizes global team code review responsiveness.","GH-300 Automation GlobalTeams"
"Your organization needs GitHub repository content backed up to separate storage outside GitHub for disaster recovery with daily incremental backups.<br><br>A) Automated git mirror with cron job pushing to separate git hosting or object storage<br>B) Manual periodic backups<br>C) Rely on GitHub only","A) Automated git mirror with cron job pushing to separate git hosting or object storage","Cron job git clones all repos, pushes to backup git server or exports bundle to S3/Blob storage daily. Manual backups create gaps. Single provider dependency creates risk. Automated external backups provide disaster recovery independent of primary SCM platform.","GH-300 Administration DisasterRecovery"
"A CI/CD workflow must execute smoke tests on deployed staging environment with automatic rollback if tests fail within 10 minutes post-deployment.<br><br>A) GitHub Actions with deployment, test job with timeout, conditional rollback step<br>B) Deploy without testing<br>C) Manual smoke testing","A) GitHub Actions with deployment, test job with timeout, conditional rollback step","Workflow deploys staging, runs smoke tests with 10min timeout, if: failure() condition triggers rollback deployment. No testing deploys broken code. Manual testing delays feedback. Automated smoke tests with rollback provide rapid deployment validation and recovery.","GH-300 CICD SmokeTesting"
"Your GitHub organization must enforce maximum repository size limits preventing repositories from exceeding 5GB to manage storage costs and performance.<br><br>A) Pre-receive hooks or repository rulesets checking repository size on push<br>B) No size limits<br>C) Manual size monitoring","A) Pre-receive hooks or repository rulesets checking repository size on push","Pre-receive hooks reject pushes exceeding size threshold (GHES), rulesets provide similar capability. No limits allow runaway storage. Manual monitoring is reactive. Proactive size enforcement prevents performance degradation and cost overruns from oversized repositories.","GH-300 Governance StorageManagement"
"A development team needs inline code suggestions during development with context-aware completions based on repository codebase and organizational patterns.<br><br>A) GitHub Copilot for Business integrated in supported IDEs<br>B) Manual code snippets library<br>C) Generic autocomplete only","A) GitHub Copilot for Business integrated in supported IDEs","Copilot provides AI-powered code suggestions trained on public code and can index organization repositories for context. Manual snippets lack intelligence. Generic autocomplete doesn't understand semantics. Copilot transforms developer productivity with context-aware AI assistance.","GH-300 AITools Development"
"Your organization requires Git hooks be standardized across all developer workstations with centralized management and automatic updates.<br><br>A) Git template directory with hooks distributed via organization repository<br>B) Email instructions for manual hook installation<br>C) No standardized hooks","A) Git template directory with hooks distributed via organization repository","Git init.templateDir points to shared hook templates, developers clone template repo, hooks auto-apply on git init/clone. Email instructions aren't followed consistently. No standardization creates inconsistent quality gates. Centralized template distribution enables standardized pre-commit validation.","GH-300 Governance GitHooks"
"A GitHub Actions workflow must deploy Lambda functions to AWS with automatic rollback if CloudWatch alarms trigger indicating errors.<br><br>A) GitHub Actions with AWS SAM/CDK deploy, CloudWatch alarm polling, conditional rollback<br>B) Deploy without monitoring<br>C) Manual rollback decision","A) GitHub Actions with AWS SAM/CDK deploy, CloudWatch alarm polling, conditional rollback","Workflow deploys Lambda, waits for CloudWatch alarm evaluation period, queries alarm state, triggers rollback deployment if alarm fires. No monitoring deploys broken functions. Manual decisions delay recovery. Automated health-check-based rollback provides safe serverless deployments.","GH-300 CICD ServerlessDeployment"
"Your company needs all GitHub repository changes logged in external SIEM system for security correlation with other enterprise events.<br><br>A) GitHub audit log streaming to SIEM via webhook or API with normalized schema<br>B) Manual log exports<br>C) GitHub logs only","A) GitHub audit log streaming to SIEM via webhook or API with normalized schema","Audit log streaming delivers events to SIEM (Splunk, Sentinel) enabling correlation with endpoint, network, and identity events. Manual exports lack timeliness. Isolated GitHub logs miss cross-system attacks. Integrated audit streaming enables holistic security monitoring.","GH-300 Security SIEMIntegration"
"A GitHub repository must support semantic versioning with automatic version bumps based on conventional commit types (feat=minor, fix=patch, BREAKING CHANGE=major).<br><br>A) semantic-release tool in GitHub Actions parsing commits and managing versions<br>B) Manual version updates<br>C) Random version numbers","A) semantic-release tool in GitHub Actions parsing commits and managing versions","semantic-release analyzes commit history, determines version bump per SemVer rules, updates package version, creates git tag, and publishes release. Manual versioning is error-prone. Random versions violate SemVer contracts. Automated semantic versioning ensures consistent, meaningful version management.","GH-300 Automation VersionManagement"
"Your organization needs GitHub Enterprise Server metrics exported to Prometheus for dashboarding and alerting on system health.<br><br>A) GitHub Enterprise Server management console exporting Prometheus metrics<br>B) Manual log parsing<br>C) No metrics collection","A) GitHub Enterprise Server management console exporting Prometheus metrics","GHES exposes Prometheus metrics endpoint for scraping (CPU, memory, git operations, Actions queues, storage). Manual log parsing doesn't scale. No metrics prevent proactive issue detection. Native Prometheus metrics enable production-grade GHES observability.","GH-300 Administration Observability"
"A CI/CD pipeline must build and sign container images with provenance attestations meeting SLSA level 3 requirements for supply chain security.<br><br>A) GitHub Actions with Docker buildx, OIDC token, Sigstore cosign, and SLSA provenance<br>B) Unsigned container builds<br>C) Manual image signing","A) GitHub Actions with Docker buildx, OIDC token, Sigstore cosign, and SLSA provenance","GitHub OIDC provides build identity, buildx generates image, cosign signs with keyless signing, SLSA provenance attests build steps. Unsigned images lack authenticity proof. Manual signing doesn't scale. Automated signing + provenance meets supply chain security standards (SLSA).","GH-300 Security SLSA"
"Your development workflow requires branch protection rules be tested before deploying to production repositories to prevent lockouts.<br><br>A) Test branch protection on pilot repository, export via API, import to production repos<br>B) Apply rules directly to production<br>C) No testing of protection rules","A) Test branch protection on pilot repository, export via API, import to production repos","Create test repo, configure protection rules, verify with test PRs, export config via API, replicate to production repos programmatically. Direct production changes risk lockouts (can't merge fixes). No testing creates surprises. Pilot testing + programmatic deployment enables safe protection rule rollout.","GH-300 Governance RiskManagement"
"A GitHub organization has 50 teams working on shared microservices. Cross-team code ownership requires approval from multiple teams before merge.<br><br>A) CODEOWNERS with multiple owner entries and branch protection requiring all reviews<br>B) Single owner per file<br>C) No cross-team review requirements","A) CODEOWNERS with multiple owner entries and branch protection requiring all reviews","CODEOWNERS supports multiple owners per path pattern (team-platform @team-a @team-b), branch protection can require reviews from all owners. Single owner misses stakeholder input. No requirements allow breaking changes. Multi-owner CODEOWNERS enables shared responsibility for critical components.","GH-300 Governance CrossTeamOwnership"
"Your CI/CD pipeline must optimize workflow execution time by sharing build artifacts between jobs without workspace duplication.<br><br>A) GitHub Actions upload-artifact and download-artifact actions<br>B) Rebuild in each job<br>C) External artifact storage only","A) GitHub Actions upload-artifact and download-artifact actions","upload-artifact saves files after build job, download-artifact retrieves in subsequent jobs sharing artifacts efficiently. Rebuilding wastes time. External storage adds complexity. Built-in artifact sharing enables fast, cost-effective workflow optimization across jobs.","GH-300 CICD ArtifactManagement"
"A GitHub repository needs automatic labeling of pull requests based on changed file paths with labels for frontend, backend, database, and documentation.<br><br>A) GitHub Actions with labeler action using path-based configuration<br>B) Manual PR labeling<br>C) No PR labels","A) GitHub Actions with labeler action using path-based configuration","Labeler action applies labels based on paths changed (src/frontend/* → frontend label), enables filtering and routing. Manual labeling is forgotten. No labels reduce PR discoverability. Automatic path-based labeling provides organized, searchable PR categorization.","GH-300 Automation PRLabeling"
"Your organization requires GitHub commits be immutable with commit signature verification required at deployment time preventing unsigned code in production.<br><br>A) Branch protection requiring signed commits and deployment workflow verifying signatures<br>B) Optional commit signing<br>C) No signature verification","A) Branch protection requiring signed commits and deployment workflow verifying signatures","Branch protection blocks unsigned commits, deployment workflow runs git verify-commit before deploying enforcing authenticity. Optional signing allows unsigned code. No verification misses impersonation. Mandatory signing + deployment verification ensures commit chain of custody.","GH-300 Security CommitIntegrity"
"A GitHub Actions workflow must deploy to Azure App Service with zero-downtime deployment using slot swaps after successful health checks.<br><br>A) GitHub Actions deploying to staging slot, health check, conditional slot swap<br>B) Direct production deployment<br>C) Manual slot management","A) GitHub Actions deploying to staging slot, health check, conditional slot swap","Workflow deploys to staging slot, runs health tests against slot URL, swaps staging to production if healthy. Direct production deploys cause downtime. Manual swaps delay deployments. Automated slot swap with validation provides zero-downtime Azure deployments.","GH-300 CICD AzureDeployment"
"Your security team needs GitHub Advanced Security findings automatically triaged with severity-based assignment to security engineers and product teams.<br><br>A) GitHub Actions processing security alerts via GraphQL API with routing logic<br>B) Manual alert triage<br>C) Email alerts only","A) GitHub Actions processing security alerts via GraphQL API with routing logic","Scheduled workflow queries security alerts via GraphQL, evaluates severity/location/type, creates assigned issues to relevant teams with SLA tags. Manual triage doesn't scale and creates backlog. Email alerts create noise. Automated intelligent triage accelerates security issue resolution.","GH-300 Security Triage"
"A GitHub repository must maintain separate documentation versions for each product release with automatic deployment to GitHub Pages.<br><br>A) GitHub Actions with versioned docs folders and Pages deployment per tag/branch<br>B) Single documentation version<br>C) Manual documentation updates","A) GitHub Actions with versioned docs folders and Pages deployment per tag/branch","Workflow on tag creates versioned docs folder (docs/v1.0), builds all versions, deploys to Pages with version selector. Single version loses historical reference. Manual updates are error-prone and slow. Versioned docs automation maintains documentation for all supported product versions.","GH-300 CICD Documentation"
"Your organization needs GitHub Enterprise Server upgraded with zero downtime for global development teams requiring 24/7 availability.<br><br>A) GitHub Enterprise Server high-availability cluster with rolling upgrade<br>B) Scheduled downtime for upgrade<br>C) Delayed upgrades to avoid downtime","A) GitHub Enterprise Server high-availability cluster with rolling upgrade","HA cluster allows replica upgrade first, failover, then primary upgrade maintaining availability. Scheduled downtime disrupts global teams. Delaying upgrades misses security patches. HA rolling upgrades enable enterprise platform continuity during maintenance.","GH-300 Administration UpgradeStrategy"