Front,Back,Extra,Tags
"Your organization needs to enforce that all GitHub repositories have README, LICENSE, and SECURITY.md files with automated validation blocking repository creation without these files.<br><br>A) Repository templates with required files and organization policies<br>B) Developer guidelines only<br>C) Manual audits","A) Repository templates with required files and organization policies","Repository templates include required files, combined with org policies and repository rulesets can enforce file presence. Guidelines don't enforce. Manual audits are reactive. Templates + policies proactively ensure repository documentation standards.","GH-300 Governance RepositoryStandards"
"A GitHub Actions workflow must deploy to multiple environments (dev, staging, production) in sequence with manual approval gates between staging and production.<br><br>A) GitHub Actions with environment-based deployments and required reviewers on production<br>B) Single workflow with no gates<br>C) Separate workflows with manual triggering","A) GitHub Actions with environment-based deployments and required reviewers on production","GitHub Environments define deployment order, required reviewers pause workflow for approval, environment secrets scope credentials. Single workflow without gates lacks safety. Separate workflows lose orchestration. Environment-based deployment provides staged rollout with human checkpoints.","GH-300 CICD ApprovalGates"
"Your security policy requires scanning GitHub Actions workflows for security issues: use of deprecated actions, credential exposure risks, and privilege escalation patterns.<br><br>A) Workflow security scanning with actionlint or third-party tools in CI<br>B) Manual workflow review<br>C) No workflow validation","A) Workflow security scanning with actionlint or third-party tools in CI","Actionlint validates workflow syntax and security practices, can be integrated into PR checks. Manual review doesn't scale and misses subtle issues. No validation creates security risk. Automated workflow scanning provides CI/CD pipeline security assurance.","GH-300 Security WorkflowSecurity"
"A GitHub repository needs different issue templates for bugs, feature requests, and security vulnerabilities with custom fields specific to each type.<br><br>A) .github/ISSUE_TEMPLATE/ folder with multiple YAML issue form templates<br>B) Single generic issue template<br>C) No issue templates","A) .github/ISSUE_TEMPLATE/ folder with multiple YAML issue form templates","Issue forms support custom fields (dropdowns, checkboxes, text), multiple templates provide type-specific structure. Generic template lacks structure. No templates result in incomplete issue reports. Multiple issue forms ensure complete, structured information collection per issue type.","GH-300 Governance IssueManagement"
"Your company requires that GitHub Actions workflows only use actions from GitHub-verified creators or internal organization actions, blocking all other third-party actions.<br><br>A) Organization action usage policy allowing verified and local actions only<br>B) Manual workflow audits<br>C) No action restrictions","A) Organization action usage policy allowing verified and local actions only","Action usage policies specify allowed action sources (verified creators, same org, specific repos), enforced at workflow execution time. Manual audits don't prevent usage. No restrictions create supply chain risk. Usage policies provide enforceable action allowlisting.","GH-300 Security ActionGovernance"
"A development team uses GitHub Discussions for Q&A, RFCs, and knowledge sharing. Popular discussions should be automatically converted to pinned wiki pages.<br><br>A) GitHub Actions with Discussions GraphQL API and wiki update automation<br>B) Manual wiki maintenance<br>C) Discussions only, no wiki","A) GitHub Actions with Discussions GraphQL API and wiki update automation","Actions workflow queries Discussions via GraphQL (by votes/activity), formats content as wiki markdown, updates wiki via git push. Manual maintenance doesn't scale. Discussions-only loses curated knowledge. Automated discussion-to-wiki pipeline creates living documentation from community knowledge.","GH-300 Automation KnowledgeManagement"
"Your organization requires bi-directional synchronization between GitHub Issues and Jira tickets with real-time updates propagating in both directions.<br><br>A) GitHub webhook + Jira webhook with bidirectional sync service or integration app<br>B) Manual ticket creation in both systems<br>C) Scheduled batch sync only","A) GitHub webhook + Jira webhook with bidirectional sync service or integration app","Webhooks from both platforms trigger sync service updating the other platform real-time, maintaining bidirectional state. Manual duplication causes drift. Batch sync creates lag. Webhook-driven bidirectional integration provides real-time cross-platform work item synchronization.","GH-300 Integration ProjectManagement"
"A GitHub Actions workflow must execute expensive end-to-end tests only when specific code paths change, not for documentation or configuration changes.<br><br>A) GitHub Actions paths filter triggering E2E tests only for source code paths<br>B) Run all tests on every push<br>C) Manual test triggering","A) GitHub Actions paths filter triggering E2E tests only for source code paths","on.push.paths: ['src/**', 'tests/**'] triggers expensive tests only when relevant code changes, docs/config changes skip. Always running wastes resources. Manual triggering loses automation. Path-based selective testing optimizes CI resource utilization.","GH-300 CICD TestOptimization"
"Your company requires GitHub Enterprise audit logs be retained for 10 years in immutable storage for compliance, with efficient querying capabilities.<br><br>A) Audit log streaming to Azure Blob with immutability policy and indexed in Azure Data Lake<br>B) Local GHES audit log retention<br>C) No long-term retention","A) Audit log streaming to Azure Blob with immutability policy and indexed in Azure Data Lake","Stream audit logs to Blob storage with legal hold/time-based retention preventing deletion, Azure Data Lake analytics enables efficient querying. Local retention has limits. No long-term storage violates compliance. Immutable cloud storage + analytics meets regulatory requirements.","GH-300 Compliance LongTermRetention"
"A GitHub organization has teams with nested membership (engineering > frontend > react-team). Repository permissions should automatically inherit from parent team hierarchy.<br><br>A) Nested teams with inherited repository access<br>B) Flat teams with manual permission replication<br>C) Individual user permissions only","A) Nested teams with inherited repository access","Nested teams inherit parent permissions automatically, child teams add permissions without removing parent access. Flat teams require duplicate permission grants. Individual permissions don't scale. Team nesting provides hierarchical, inherited access control mirroring org structure.","GH-300 Governance TeamHierarchy"
"Your development workflow requires that pull requests from external contributors be reviewed and approved before workflow execution to prevent malicious code in Actions.<br><br>A) Branch protection requiring pull request reviews and first-time contributor workflow approval<br>B) Allow all workflows to run automatically<br>C) Disable external contributions","A) Branch protection requiring pull request reviews and first-time contributor workflow approval","Public repos require first-time contributor workflow approval by maintainer before Actions run, reviewers verify code safety. Auto-run creates risk (crypto mining, credential theft). Disabling contributions harms OSS. Approval gates balance security with open collaboration.","GH-300 Security OSSSecurity"
"A GitHub Enterprise Server deployment must support LDAP authentication integration with nested group membership and automatic team synchronization.<br><br>A) GitHub Enterprise Server LDAP Sync with nested group support<br>B) Manual user and team management<br>C) GitHub.com authentication only","A) GitHub Enterprise Server LDAP Sync with nested group support","GHES LDAP Sync automatically provisions users, synchronizes team membership based on LDAP groups including nested groups. Manual management doesn't scale and creates drift. GitHub.com doesn't support LDAP. LDAP Sync provides automated identity and access lifecycle from enterprise directory.","GH-300 Authentication LDAPIntegration"
"Your CI/CD pipeline must build multi-architecture container images (amd64, arm64) for cross-platform deployment with single image manifest.<br><br>A) GitHub Actions with Docker buildx multi-platform builds and manifest lists<br>B) Separate builds with architecture-specific tags<br>C) Single architecture only","A) GitHub Actions with Docker buildx multi-platform builds and manifest lists","Docker buildx builds multiple architectures in one command, creates manifest list enabling single tag for all platforms. Separate builds create management complexity. Single arch limits deployment targets. Multi-platform buildx enables universal container images.","GH-300 CICD MultiArchitecture"
"A GitHub repository must enforce rebase-only merges to maintain linear history, preventing merge commits and squashing.<br><br>A) Branch protection allowing rebase merge only, disabling merge commit and squash<br>B) Developer guidelines<br>C) Pre-receive hooks","A) Branch protection allowing rebase merge only, disabling merge commit and squash","Repository merge button settings specify allowed merge types, branch protection enforces. Guidelines don't enforce behavior. Pre-receive hooks are complex. Native merge type restrictions provide simple, enforceable history linearity.","GH-300 Governance MergeStrategy"
"Your organization needs to track technical debt by labeling issues/PRs with debt categories and measure debt accumulation over time with visualization.<br><br>A) GitHub Issues with custom labels and Projects tracking debt metrics via GraphQL API<br>B) Spreadsheet debt tracking<br>C) No debt tracking","A) GitHub Issues with custom labels and Projects tracking debt metrics via GraphQL API","Label issues with technical-debt labels (security, performance, refactor), Projects aggregate by label, GraphQL API exports time-series data for charting. Spreadsheets create duplication. No tracking prevents debt management. Native GitHub features + API enables integrated debt visibility.","GH-300 ProjectManagement TechnicalDebt"
"A GitHub Actions workflow must provision cloud infrastructure using Terraform with diff preview in PR comments before applying changes.<br><br>A) GitHub Actions with Terraform plan, post plan diff to PR comments, apply on merge<br>B) Terraform apply without preview<br>C) Manual infrastructure changes","A) GitHub Actions with Terraform plan, post plan diff to PR comments, apply on merge","Actions on pull_request runs terraform plan, GitHub bot comments with diff, merge triggers terraform apply. No preview creates surprise changes. Manual IaC defeats automation. Plan-in-PR-comments provides reviewable infrastructure changes as code review.","GH-300 CICD InfrastructurePreview"
"Your security team requires all repository secrets be rotated every 60 days with automated expiration notifications to repository admins.<br><br>A) Secret metadata tracking with scheduled workflow checking age and notifying via Issues/Slack<br>B) Manual secret rotation tracking<br>C) No rotation policy","A) Secret metadata tracking with scheduled workflow checking age and notifying via Issues/Slack","Track secret creation dates (in separate metadata), scheduled Action checks age, creates issue or sends notification when approaching expiration. Manual tracking doesn't scale. No rotation leaves stale credentials. Automated secret age monitoring enables proactive credential lifecycle management.","GH-300 Security SecretRotation"
"A GitHub repository uses GitHub Packages to distribute container images. Access to private images should be controlled via fine-grained package permissions separate from repository access.<br><br>A) GitHub Packages with granular package visibility and permission settings<br>B) Repository permissions only<br>C) Public packages only","A) GitHub Packages with granular package visibility and permission settings","Packages support independent access control (inherit from repo or custom), enabling different teams to access packages vs. code. Repo permissions are too coarse. Public packages expose private artifacts. Granular package permissions provide artifact-level access control.","GH-300 Security PackageSecurity"
"Your development team needs to automatically assign pull requests to reviewers based on round-robin distribution ensuring workload balance.<br><br>A) GitHub Actions with reviewer assignment logic using round-robin algorithm and GraphQL API<br>B) Manual PR assignment<br>C) Random reviewer assignment only","A) GitHub Actions with reviewer assignment logic using round-robin algorithm and GraphQL API","Action workflow on PR opened tracks last assignee in storage, assigns next reviewer in rotation via API balancing load. Manual assignment creates uneven distribution. Random assignment doesn't balance workload. Round-robin automation provides fair reviewer load distribution.","GH-300 Automation ReviewManagement"
"A GitHub Enterprise organization must enforce that all repositories have branch protection enabled on default branch before any code can be pushed.<br><br>A) Repository rulesets applied at organization level requiring branch protection<br>B) Manual repository configuration<br>C) Post-creation audit and remediation","A) Repository rulesets applied at organization level requiring branch protection","Repository rulesets (newer than branch protection) apply rules organization-wide or by pattern, enforced at creation time. Manual config doesn't scale. Post-creation audit allows unprotected period. Rulesets provide proactive, scalable repository policy enforcement.","GH-300 Governance PolicyEnforcement"
"Your CI/CD pipeline must generate and publish test coverage reports with historical trend tracking and automatic PR comments showing coverage changes.<br><br>A) GitHub Actions with coverage tool, Codecov/Coveralls integration, and PR comment action<br>B) Local coverage reports only<br>C) No coverage tracking","A) GitHub Actions with coverage tool, Codecov/Coveralls integration, and PR comment action","Actions run coverage tool (jest, pytest), publish to coverage service with trend analysis, bot comments on PR with coverage diff. Local reports lack team visibility. No tracking allows coverage degradation. Integrated coverage reporting provides quality metrics with PR feedback.","GH-300 CICD QualityMetrics"
"A GitHub organization needs to provide external auditors read-only access to all repositories and audit logs without granting them user accounts.<br><br>A) GitHub App with read-only permissions installed at organization level<br>B) Create user accounts for auditors<br>C) Export and email data regularly","A) GitHub App with read-only permissions installed at organization level","GitHub App with contents:read and organization:read permissions provides API access to repos and audit logs without user account (better audit trail, limited permissions). User accounts grant more access than needed. Email exports aren't real-time. App-based access provides secure, scoped external audit capabilities.","GH-300 Security ExternalAccess"
"Your development workflow requires that all commits include an issue reference (#123) with validation blocking commits missing issue links.<br><br>A) GitHub Actions validating commit messages and blocking merge via required status checks<br>B) Developer guidelines only<br>C) Post-merge audit","A) GitHub Actions validating commit messages and blocking merge via required status checks","Action on pull_request parses commits for issue references (#123), fails check if missing, branch protection prevents merge. Guidelines don't enforce. Post-merge audit is reactive. Pre-merge commit validation enforces traceability between code and work items.","GH-300 Governance Traceability"
"A GitHub repository must support multiple deployment environments (dev, staging, production) with environment-specific approval workflows, secrets, and deployment history tracking.<br><br>A) GitHub Environments with per-environment secrets, required reviewers, and deployment logs<br>B) Single environment with shared configuration<br>C) External deployment tools only","A) GitHub Environments with per-environment secrets, required reviewers, and deployment logs","Environments provide isolated secrets, reviewer requirements, deployment protection rules, and history per environment. Shared environment lacks separation. External tools duplicate GitHub capabilities. Environments are GitHub's native multi-stage deployment construct.","GH-300 CICD EnvironmentManagement"
"Your organization needs GitHub repository settings standardized across 300 repositories with version control and automated consistency checks.<br><br>A) Infrastructure-as-code for GitHub repositories using Terraform GitHub provider<br>B) Manual repository configuration<br>C) One-time bulk update script","A) Infrastructure-as-code for GitHub repositories using Terraform GitHub provider","Terraform GitHub provider manages repos, teams, branch protection as code enabling version control, review, and consistency. Manual config creates drift (300 repos). One-time scripts don't maintain state. Repository-as-code provides versioned, reviewable, consistent repository configuration management.","GH-300 Governance InfrastructureAsCode"
"A CI/CD workflow must parallelize test execution across multiple test suites with failure isolation ensuring one failing suite doesn't block others.<br><br>A) GitHub Actions matrix strategy with continue-on-error per job<br>B) Sequential test execution<br>C) Single test suite","A) GitHub Actions matrix strategy with continue-on-error per job","Matrix executes test suites in parallel jobs, continue-on-error: true on individual jobs prevents cascading failures, final step aggregates results. Sequential is slow. Single suite has no isolation. Parallel with failure isolation optimizes test execution speed and feedback.","GH-300 CICD TestParallelization"
"Your organization requires that internal GitHub packages not be externally accessible even with authentication, enforcing network-level access control.<br><br>A) GitHub Enterprise with IP allowlists restricting package registry access<br>B) Package visibility settings only<br>C) No network restrictions","A) GitHub Enterprise with IP allowlists restricting package registry access","IP allowlists enforce network perimeter for package access, even with valid auth tokens access blocked from non-allowed IPs. Visibility alone doesn't restrict network access. No network control allows credential exfiltration. IP allowlists provide defense-in-depth for sensitive packages.","GH-300 Security NetworkSecurity"
"A GitHub Actions workflow must securely access HashiCorp Vault secrets without storing Vault tokens, using dynamic credential retrieval.<br><br>A) GitHub OIDC provider with Vault JWT authentication<br>B) Vault token in GitHub secrets<br>C) Hardcoded Vault credentials","A) GitHub OIDC provider with Vault JWT authentication","GitHub OIDC issues JWT, Vault JWT auth validates GitHub identity and issues short-lived Vault token, no static credentials stored. Token in secrets requires rotation. Hardcoding is insecure. OIDC + Vault JWT auth provides secretless secrets management integration.","GH-300 Security VaultIntegration"
"Your development team needs to enforce code formatting standards automatically, with pull requests blocked if code doesn't match the defined style.<br><br>A) GitHub Actions with formatter tool (prettier, black) and required style check<br>B) Manual code review for formatting<br>C) Developer IDE settings only","A) GitHub Actions with formatter tool (prettier, black) and required style check","Action runs formatter verification on PR, fails check if formatting doesn't match, branch protection blocks merge. Manual review wastes reviewer time. IDE settings aren't enforced. Automated style checks enforce consistent formatting freeing reviewers for substantive review.","GH-300 CICD CodeQuality"
"A GitHub Enterprise deployment needs single sign-on with multi-factor authentication enforced, automatic user provisioning from Okta, and deprovisioning on termination.<br><br>A) SAML SSO with Okta, SCIM provisioning, and MFA enforced in Okta<br>B) Username/password authentication<br>C) Manual user account management","A) SAML SSO with Okta, SCIM provisioning, and MFA enforced in Okta","SAML provides federated auth, Okta enforces MFA, SCIM automates user lifecycle (provision on hire, deprovision on termination). Username/password lacks SSO and automation. Manual management doesn't scale and is slow. SAML+SCIM+MFA provides complete enterprise identity integration.","GH-300 Authentication EnterpriseSSO"
"Your organization requires GitHub Copilot suggestions be filtered to exclude code matching public repositories to avoid license compliance issues.<br><br>A) GitHub Copilot with public code filter enabled in organization settings<br>B) No filtering, trust all suggestions<br>C) Disable Copilot entirely","A) GitHub Copilot with public code filter enabled in organization settings","Copilot public code filter blocks suggestions matching public code, reducing license risk. No filtering creates compliance exposure. Disabling loses productivity benefits. Public code filtering balances AI-assisted development with license compliance.","GH-300 AITools ComplianceWhy is this necessary for legal compliance?","GH-300 AITools Compliance"
"A GitHub repository uses submodules for shared libraries. CI/CD workflows must recursively checkout submodules with specific authentication for private submodule repositories.<br><br>A) GitHub Actions checkout action with submodules: recursive and token parameter<br>B) Manual git submodule commands<br>C) No submodule support","A) GitHub Actions checkout action with submodules: recursive and token parameter","Checkout action submodules: recursive fetches all nested submodules, token parameter provides auth for private repos. Manual commands add complexity. No submodule support breaks builds. First-class submodule checkout support enables monorepo patterns with shared libraries.","GH-300 CICD Submodules"
"Your security team needs to identify all GitHub repositories containing specific types of sensitive data (SSN patterns, credit card numbers) across 500 repositories.<br><br>A) GitHub Advanced Security custom secret scanning patterns at organization level<br>B) Manual repository searching<br>C) No sensitive data detection","A) GitHub Advanced Security custom secret scanning patterns at organization level","Custom secret scanning patterns (regex) detect organization-specific sensitive data, scan across all repos, alert on detection. Manual search doesn't scale (500 repos). No detection leaves data exposure risk. Custom patterns extend secret scanning to domain-specific sensitive data.","GH-300 Security DataLossPrevention"
"A GitHub Actions workflow deploys to production with a required manual approval from deployment managers, with approval requests sent via Slack for immediate visibility.<br><br>A) GitHub Environment with required reviewers and Actions Slack integration for notifications<br>B) Email approval only<br>C) No approval workflow","A) GitHub Environment with required reviewers and Actions Slack integration for notifications","Environment required reviewers pause deployment, Slack Action sends notification with approval link on deployment trigger. Email lacks immediacy. No approvals create change management risk. Environment approvals + Slack notifications enable timely, controlled production deployments.","GH-300 CICD DeploymentApprovals"
"Your organization requires all GitHub Actions workflows be reviewed by security team before execution, with a workflow approval process for new or modified workflows.<br><br>A) Branch protection on .github/workflows/ path requiring security team review<br>B) Post-merge workflow audits<br>C) No workflow review","A) Branch protection on .github/workflows/ path requiring security team review","CODEOWNERS for .github/workflows/* assigns security team, branch protection requires owner review before merge. Post-merge audit is reactive and workflows already ran. No review creates pipeline security risk. Pre-merge workflow review provides preventive CI/CD security control.","GH-300 Security WorkflowReview"
"A development project needs dependency version updates automatically proposed weekly with grouped PRs per dependency type (npm, pip, go modules).<br><br>A) Dependabot with scheduled updates and grouped update strategy<br>B) Manual dependency updates<br>C) No dependency updates","A) Dependabot with scheduled updates and grouped update strategy","Dependabot schedule interval configures update frequency, groups configuration batches updates by package manager or pattern reducing PR noise. Manual updates lag behind security patches. No updates accumulate vulnerability debt. Scheduled grouped Dependabot provides manageable, regular dependency maintenance.","GH-300 Security DependencyAutomation"
